{
  "id": "04-lost-comms",
  "title": "Lost Comms: AVEF & MEA",
  "topicArea": "emergencies",
  "references": {
    "acs": [
      "IR.VII.A"
    ],
    "faa": {
      "source": "14 CFR 91.185",
      "title": "IFR operations: Two-way radio communications failure"
    }
  },
  "hook": "The radio just died in the clouds. What now?",
  "scenes": [
    {
      "id": "scene-01",
      "kind": "title",
      "narration": "Thirty seconds. The radio dies in the clouds. Ninety-one one eighty-five answers two questions: where do I go, and how high.",
      "onScreenText": [
        "Lost Comms in IMC",
        "14 CFR 91.185"
      ],
      "duke": {
        "pose": "stand",
        "expression": "deadpan",
        "position": "center"
      },
      "minDurationSec": 3
    },
    {
      "id": "scene-02",
      "kind": "bullets",
      "narration": "Break out into V F R? Stay V F R and land. A handheld radio is two hundred bucks — the cheapest life insurance on the market.",
      "onScreenText": [
        "VFR conditions?",
        "Stay VFR. Land. Done."
      ],
      "duke": {
        "pose": "point",
        "expression": "neutral",
        "position": "left"
      },
      "minDurationSec": 4
    },
    {
      "id": "scene-03",
      "kind": "diagram",
      "narration": "Still in the soup — route: A V E F. Assigned. Vectored. Expected. Filed. In that order.",
      "onScreenText": [
        "Route: AVEF",
        "Assigned → Vectored → Expected → Filed"
      ],
      "diagram": {
        "type": "routeAltitude",
        "props": {
          "variant": "route"
        }
      },
      "duke": {
        "pose": "point",
        "expression": "squint",
        "position": "corner"
      },
      "minDurationSec": 5
    },
    {
      "id": "scene-04",
      "kind": "diagram",
      "narration": "Altitude: the highest of three, per segment. M E A, Expected, Assigned. The rocks don't negotiate.",
      "onScreenText": [
        "Altitude: highest of",
        "MEA · Expected · Assigned"
      ],
      "diagram": {
        "type": "routeAltitude",
        "props": {
          "variant": "altitude"
        }
      },
      "duke": {
        "pose": "armsCrossed",
        "expression": "eyebrowRaise",
        "position": "corner"
      },
      "minDurationSec": 5
    },
    {
      "id": "scene-05",
      "kind": "recap",
      "narration": "Squawk seventy-six hundred and keep flying the airplane — it doesn't know the radio's dead.",
      "onScreenText": [
        "Route: AVEF",
        "Altitude: highest of MEA/E/A",
        "Squawk 7600"
      ],
      "duke": {
        "pose": "stand",
        "expression": "neutral",
        "position": "center"
      },
      "minDurationSec": 4
    },
    {
      "id": "scene-06",
      "kind": "sources",
      "narration": "Ninety-one one eighty-five. Two paragraphs. Memorize both.",
      "onScreenText": [
        "ACS: IR.VII.A",
        "14 CFR 91.185 — Two-way radio failure"
      ],
      "duke": {
        "pose": "coffeeSip",
        "expression": "deadpan",
        "position": "corner"
      },
      "minDurationSec": 3
    }
  ],
  "quiz": [
    {
      "question": "Lost comms in IMC. Route priority under 91.185 is:",
      "choices": [
        "Assigned, Vectored, Expected, Filed",
        "Filed, Expected, Vectored, Assigned",
        "Direct destination, then as filed",
        "Expected, Assigned, Filed, Vectored"
      ],
      "correctIndex": 0,
      "explanation": "AVEF: the route Assigned; if being Vectored, direct to the fix/route the vector was for; then Expected; then Filed."
    },
    {
      "question": "Lost comms altitude for each segment is the HIGHEST of:",
      "choices": [
        "MEA, expected altitude, assigned altitude",
        "MEA, MOCA, MRA",
        "Filed altitude, MEA, 3,000 AGL",
        "Assigned altitude only"
      ],
      "correctIndex": 0,
      "explanation": "91.185(c)(2): fly the highest of the minimum IFR altitude (MEA), the altitude ATC told you to expect, or your last assigned altitude."
    },
    {
      "question": "Radio fails and you encounter VFR conditions. You should:",
      "choices": [
        "Continue VFR and land as soon as practicable",
        "Climb back into IMC and fly AVEF",
        "Hold until your filed ETA",
        "Continue IFR to your destination"
      ],
      "correctIndex": 0,
      "explanation": "91.185(b): if you hit VFR conditions after the failure, remain VFR and land as soon as practicable."
    }
  ]
}
