{
  "id": "09-rnav-minima",
  "title": "LPV vs LNAV: The Minima Lines",
  "topicArea": "approaches",
  "references": {
    "acs": [
      "IR.VI.A"
    ],
    "faa": {
      "source": "AIM 1-1-18",
      "title": "Wide Area Augmentation System (WAAS)"
    }
  },
  "hook": "Four lines of minimums on one RNAV plate. Which one is yours?",
  "scenes": [
    {
      "id": "scene-01",
      "kind": "title",
      "narration": "Thirty seconds. R NAV minima. One plate, a stack of lines — your equipment picks your line.",
      "onScreenText": [
        "RNAV (GPS) Minima",
        "LPV · LNAV/VNAV · LNAV"
      ],
      "duke": {
        "pose": "stand",
        "expression": "deadpan",
        "position": "center"
      },
      "minDurationSec": 3
    },
    {
      "id": "scene-02",
      "kind": "bullets",
      "narration": "Top of the stack: L P V. WAAS gives you I L S-style guidance down to two hundred feet. No ground station, just very fancy math.",
      "onScreenText": [
        "LPV (needs WAAS)",
        "Angular guidance, DA to 200 ft",
        "Flown like an ILS"
      ],
      "duke": {
        "pose": "point",
        "expression": "neutral",
        "position": "left"
      },
      "minDurationSec": 4
    },
    {
      "id": "scene-03",
      "kind": "bullets",
      "narration": "L NAV V NAV: a D A with vertical guidance. Plain L NAV: step down to an M D A like it's nineteen seventy-five.",
      "onScreenText": [
        "LNAV/VNAV: DA, vertical guidance",
        "LNAV: lateral only → MDA"
      ],
      "duke": {
        "pose": "armsCrossed",
        "expression": "squint",
        "position": "right"
      },
      "minDurationSec": 4
    },
    {
      "id": "scene-04",
      "kind": "bullets",
      "narration": "Check the annunciator by the final fix. Fly the line the box gives you, not the line you hoped for.",
      "onScreenText": [
        "Check the annunciation by the FAF",
        "Fly what the box gives you"
      ],
      "duke": {
        "pose": "point",
        "expression": "eyebrowRaise",
        "position": "left"
      },
      "minDurationSec": 4
    },
    {
      "id": "scene-05",
      "kind": "recap",
      "narration": "L P V like an I L S. Plain L NAV, dive-and-drive. Read the box's report card.",
      "onScreenText": [
        "LPV ≈ ILS",
        "L/VNAV: DA",
        "LNAV: MDA"
      ],
      "duke": {
        "pose": "coffeeSip",
        "expression": "grin",
        "position": "center"
      },
      "minDurationSec": 4
    },
    {
      "id": "scene-06",
      "kind": "sources",
      "narration": "A I M one dash one dash eighteen. WAAS, explained by the hour.",
      "onScreenText": [
        "ACS: IR.VI.A",
        "AIM 1-1-18 — WAAS"
      ],
      "duke": {
        "pose": "coffeeSip",
        "expression": "deadpan",
        "position": "corner"
      },
      "minDurationSec": 3
    }
  ],
  "quiz": [
    {
      "question": "Which RNAV minima line requires WAAS and provides ILS-like angular guidance?",
      "choices": [
        "LPV",
        "LNAV",
        "LNAV+V",
        "Circling"
      ],
      "correctIndex": 0,
      "explanation": "LPV (Localizer Performance with Vertical guidance) uses WAAS for angular guidance and DAs as low as 200 ft. (AIM 1-1-18)"
    },
    {
      "question": "Flying to plain LNAV minimums, you descend to...",
      "choices": [
        "An MDA — level off until the missed point or runway in sight",
        "A DA — decide as you reach it",
        "200 ft AGL automatically",
        "The circling MDA only"
      ],
      "correctIndex": 0,
      "explanation": "LNAV is lateral-only; its minimum is an MDA you must not descend below without the runway environment. (91.175)"
    },
    {
      "question": "Your GPS annunciates \"LNAV\" on an approach you briefed for LPV. You should:",
      "choices": [
        "Use the LNAV minima line",
        "Use LPV minimums anyway",
        "Ask ATC to fix your WAAS signal",
        "Switch to the ILS frequency"
      ],
      "correctIndex": 0,
      "explanation": "The annunciated service level determines your line of minima — fly what the box is actually providing."
    }
  ]
}
