{
  "id": "18-dps-stars",
  "title": "DPs & STARs: The On-Ramps and Off-Ramps",
  "topicArea": "clearances",
  "references": {
    "acs": [
      "IR.I.C",
      "IR.III.A"
    ],
    "faa": {
      "source": "FAA-H-8083-16B Ch. 1 & 3",
      "title": "Instrument Procedures Handbook — Departures & Arrivals"
    }
  },
  "hook": "The airway system has on-ramps and off-ramps. Here's how to merge.",
  "scenes": [
    {
      "id": "scene-01",
      "kind": "title",
      "narration": "Last one, kid. Departures and STARs — the on-ramps and off-ramps of the airway system.",
      "onScreenText": [
        "DPs & STARs",
        "On-ramps & off-ramps"
      ],
      "duke": {
        "pose": "stand",
        "expression": "deadpan",
        "position": "center"
      },
      "minDurationSec": 3
    },
    {
      "id": "scene-02",
      "kind": "bullets",
      "narration": "O D Ps keep you off the rocks — fly one anytime, no clearance needed. SIDs organize the flow — ATC assigns those.",
      "onScreenText": [
        "ODP: obstacle protection, fly-anytime",
        "SID: ATC-assigned, flow + obstacles"
      ],
      "duke": {
        "pose": "point",
        "expression": "neutral",
        "position": "left"
      },
      "minDurationSec": 4
    },
    {
      "id": "scene-03",
      "kind": "diagram",
      "narration": "Unless published otherwise: cross the end at thirty-five feet, climb two hundred feet per NAUTICAL MILE. Per mile — not per minute. Do the math.",
      "onScreenText": [
        "Standard climb: 200 ft/NM",
        "(per NM, not per minute!)"
      ],
      "diagram": {
        "type": "routeAltitude",
        "props": {
          "variant": "climb"
        }
      },
      "duke": {
        "pose": "armsCrossed",
        "expression": "squint",
        "position": "corner"
      },
      "minDurationSec": 5
    },
    {
      "id": "scene-04",
      "kind": "bullets",
      "narration": "STARs funnel arrivals downhill in order. 'Descend via': fly the chart's altitudes. 'Descend and maintain': fly ATC's number. Don't freelance.",
      "onScreenText": [
        "STAR: published arrival flow",
        "\"Descend via\" → fly the chart",
        "\"Descend & maintain\" → fly ATC's altitude"
      ],
      "duke": {
        "pose": "point",
        "expression": "eyebrowRaise",
        "position": "right"
      },
      "minDurationSec": 4
    },
    {
      "id": "scene-05",
      "kind": "recap",
      "narration": "O D P for rocks, SID for flow, two hundred per mile. Merge like you've done it before.",
      "onScreenText": [
        "ODP: rocks · SID: flow",
        "200 ft/NM standard",
        "\"Via\" vs \"maintain\""
      ],
      "duke": {
        "pose": "coffeeSip",
        "expression": "neutral",
        "position": "center"
      },
      "minDurationSec": 4
    },
    {
      "id": "scene-06",
      "kind": "sources",
      "narration": "Instrument Procedures Handbook, chapters one and three. Free P D F — costs only your evening.",
      "onScreenText": [
        "ACS: IR.I.C / IR.III.A",
        "FAA-H-8083-16B Ch. 1 & 3"
      ],
      "duke": {
        "pose": "coffeeSip",
        "expression": "deadpan",
        "position": "corner"
      },
      "minDurationSec": 3
    }
  ],
  "quiz": [
    {
      "question": "The primary purpose of an ODP is:",
      "choices": [
        "Obstacle clearance on departure",
        "Noise abatement",
        "Traffic flow management",
        "Reducing radio congestion"
      ],
      "correctIndex": 0,
      "explanation": "ODPs exist solely for obstruction clearance and may be flown without an ATC clearance; SIDs add flow management and are assigned."
    },
    {
      "question": "Unless otherwise published, an IFR departure procedure assumes a minimum climb of:",
      "choices": [
        "200 ft per nautical mile",
        "200 ft per minute",
        "500 ft per minute",
        "300 ft per nautical mile"
      ],
      "correctIndex": 0,
      "explanation": "The standard is crossing the departure end at 35 ft and climbing 200 ft/NM — a gradient, not a rate. Convert using groundspeed."
    },
    {
      "question": "Cleared to \"descend via\" a STAR, you should:",
      "choices": [
        "Comply with the published altitude (and speed) restrictions on the chart",
        "Descend to the lowest chart altitude immediately",
        "Wait for a hard altitude from ATC",
        "Request vectors"
      ],
      "correctIndex": 0,
      "explanation": "\"Descend via\" delegates the vertical profile to you — fly the STAR's published restrictions without further instruction."
    }
  ]
}
