{
  "id": "06-approach-brief",
  "title": "Brief a Plate Like a Pro",
  "topicArea": "approaches",
  "references": {
    "acs": [
      "IR.VI.A",
      "IR.VI.B"
    ],
    "faa": {
      "source": "FAA-H-8083-16B Ch. 4",
      "title": "Instrument Procedures Handbook — Approaches"
    }
  },
  "hook": "Ten miles out is a terrible place to meet your approach plate.",
  "scenes": [
    {
      "id": "scene-01",
      "kind": "title",
      "narration": "Thirty seconds. Briefing a plate — top to bottom, same order every time. Like a menu, except the special is granite.",
      "onScreenText": [
        "The Approach Brief",
        "Top to bottom. Every time."
      ],
      "duke": {
        "pose": "stand",
        "expression": "deadpan",
        "position": "center"
      },
      "minDurationSec": 3
    },
    {
      "id": "scene-02",
      "kind": "diagram",
      "narration": "Top strip: frequencies, final course, runway. Then the notes — that's where the fine print hides.",
      "onScreenText": [
        "1. Briefing strip: freqs, course, runway",
        "2. Notes: read the fine print"
      ],
      "diagram": {
        "type": "approachPlateProfile",
        "props": {
          "highlight": "top"
        }
      },
      "duke": {
        "pose": "point",
        "expression": "neutral",
        "position": "corner"
      },
      "minDurationSec": 5
    },
    {
      "id": "scene-03",
      "kind": "diagram",
      "narration": "Plan view for the big picture. Profile for the step-downs, the fix, and where the missed begins.",
      "onScreenText": [
        "3. Plan view: the big picture",
        "4. Profile: FAF, stepdowns, missed point"
      ],
      "diagram": {
        "type": "approachPlateProfile",
        "props": {
          "highlight": "profile"
        }
      },
      "duke": {
        "pose": "point",
        "expression": "squint",
        "position": "corner"
      },
      "minDurationSec": 5
    },
    {
      "id": "scene-04",
      "kind": "bullets",
      "narration": "Finish with minimums and the missed — out loud. Can't say the missed from memory? You briefed a bedtime story.",
      "onScreenText": [
        "5. Minimums: DA or MDA + vis",
        "6. Missed: say it out loud"
      ],
      "duke": {
        "pose": "armsCrossed",
        "expression": "eyebrowRaise",
        "position": "left"
      },
      "minDurationSec": 4
    },
    {
      "id": "scene-05",
      "kind": "recap",
      "narration": "Strip, notes, plan, profile, minimums, missed. Brief it before it briefs you.",
      "onScreenText": [
        "Strip → Notes → Plan",
        "→ Profile → Mins → Missed"
      ],
      "duke": {
        "pose": "coffeeSip",
        "expression": "neutral",
        "position": "center"
      },
      "minDurationSec": 4
    },
    {
      "id": "scene-06",
      "kind": "sources",
      "narration": "Instrument Procedures Handbook, chapter four. Four hundred pages so you'd read six.",
      "onScreenText": [
        "ACS: IR.VI.A / IR.VI.B",
        "FAA-H-8083-16B Ch. 4 — Approaches"
      ],
      "duke": {
        "pose": "coffeeSip",
        "expression": "deadpan",
        "position": "corner"
      },
      "minDurationSec": 3
    }
  ],
  "quiz": [
    {
      "question": "A solid approach brief flows in what order?",
      "choices": [
        "Briefing strip, notes, plan view, profile, minimums, missed",
        "Minimums first, then frequencies",
        "Missed approach, then plan view, then strip",
        "Whatever order the plate prints them"
      ],
      "correctIndex": 0,
      "explanation": "Top-to-bottom keeps the brief consistent and complete — ending with minimums and the missed so they're freshest."
    },
    {
      "question": "Why brief the missed approach out loud before the FAF?",
      "choices": [
        "At minimums there's no time to read — you fly it from memory",
        "ATC requires a readback of the missed",
        "It's only needed for circling approaches",
        "So your passenger can fly it"
      ],
      "correctIndex": 0,
      "explanation": "The missed happens at the busiest, lowest moment of the approach. The first steps must already be loaded in your head."
    }
  ]
}
